post_id,text,post_text,shared_text,time,image,images,video,video_thumbnail,video_id,likes,comments,shares,post_url,link,user_id,username,is_live,factcheck,shared_post_id,shared_time,shared_user_id,shared_username,shared_post_url,available,comments_full
4041421799275576,"Nintendo Switch
13 hrs ·

Which games from the latest Indie World Showcase were you most excited to see?

Learn more about these indie games here: https://nintendo.com/indie-world",,"Nintendo Switch
13 hrs ·

Which games from the latest Indie World Showcase were you most excited to see?

Learn more about these indie games here: https://nintendo.com/indie-world",2021-04-15 14:00:14,https://scontent-bog1-1.xx.fbcdn.net/v/t1.6435-9/fr/cp0/e15/q65/173805229_3814486105314086_8547409440029801582_n.jpg?_nc_cat=1&ccb=1-3&_nc_sid=2d5d41&_nc_ohc=moD1wu_2HaIAX8VSyTD&_nc_ht=scontent-bog1-1.xx&tp=14&oh=a41dbe5b3b22fdd883976580a1aee972&oe=609FCDAA,"['https://scontent-bog1-1.xx.fbcdn.net/v/t1.6435-9/fr/cp0/e15/q65/173805229_3814486105314086_8547409440029801582_n.jpg?_nc_cat=1&ccb=1-3&_nc_sid=2d5d41&_nc_ohc=moD1wu_2HaIAX8VSyTD&_nc_ht=scontent-bog1-1.xx&tp=14&oh=a41dbe5b3b22fdd883976580a1aee972&oe=609FCDAA', 'https://scontent-bog1-1.xx.fbcdn.net/v/t1.6435-9/fr/cp0/e15/q65/173805229_3814486105314086_8547409440029801582_n.jpg?_nc_cat=1&ccb=1-3&_nc_sid=2d5d41&_nc_ohc=moD1wu_2HaIAX8VSyTD&_nc_ht=scontent-bog1-1.xx&tp=14&oh=a41dbe5b3b22fdd883976580a1aee972&oe=609FCDAA', 'https://scontent-bog1-1.xx.fbcdn.net/v/t1.6435-9/fr/cp0/e15/q65/173805229_3814486105314086_8547409440029801582_n.jpg?_nc_cat=1&ccb=1-3&_nc_sid=2d5d41&_nc_ohc=moD1wu_2HaIAX8VSyTD&_nc_ht=scontent-bog1-1.xx&tp=14&oh=a41dbe5b3b22fdd883976580a1aee972&oe=609FCDAA']",,,,233,102,15,https://facebook.com/nintendo/posts/4041421799275576,https://nintendo.com/indie-world,119240841493711,Nintendo,False,,,,,,,True,
4041351039282652,,,,2021-04-15 13:30:00,https://scontent-bog1-1.xx.fbcdn.net/v/t1.6435-9/fr/cp0/e15/q65/174452791_4041351042615985_8801177899915549195_n.jpg?_nc_cat=109&ccb=1-3&_nc_sid=2d5d41&_nc_ohc=GBkXA4vwzsoAX-3H-pL&_nc_ht=scontent-bog1-1.xx&tp=14&oh=e90f6c70454fbec5cdb331f872f4bd99&oe=609D0372,"['https://scontent-bog1-1.xx.fbcdn.net/v/t1.6435-9/fr/cp0/e15/q65/174452791_4041351042615985_8801177899915549195_n.jpg?_nc_cat=109&ccb=1-3&_nc_sid=2d5d41&_nc_ohc=GBkXA4vwzsoAX-3H-pL&_nc_ht=scontent-bog1-1.xx&tp=14&oh=e90f6c70454fbec5cdb331f872f4bd99&oe=609D0372', 'https://scontent-bog1-1.xx.fbcdn.net/v/t1.6435-9/fr/cp0/e15/q65/174452791_4041351042615985_8801177899915549195_n.jpg?_nc_cat=109&ccb=1-3&_nc_sid=2d5d41&_nc_ohc=GBkXA4vwzsoAX-3H-pL&_nc_ht=scontent-bog1-1.xx&tp=14&oh=e90f6c70454fbec5cdb331f872f4bd99&oe=609D0372', 'https://scontent-bog1-1.xx.fbcdn.net/v/t1.6435-9/fr/cp0/e15/q65/174452791_4041351042615985_8801177899915549195_n.jpg?_nc_cat=109&ccb=1-3&_nc_sid=2d5d41&_nc_ohc=GBkXA4vwzsoAX-3H-pL&_nc_ht=scontent-bog1-1.xx&tp=14&oh=e90f6c70454fbec5cdb331f872f4bd99&oe=609D0372']",,,,446,87,0,https://facebook.com/nintendo/posts/4041351039282652,http://ninten.do/6183VjW5l,119240841493711,Nintendo,False,,,,,,,True,
4037559799661776,"Today marks the 20th anniversary of the Animal Crossing series! What are your favorite memories? Thank you to everyone who has played throughout the years, and we look forward to sharing more memories together in the future!

If you’ve not played before, Animal Crossing: New Horizons is now available on Nintendo Switch!
http://ninten.do/6181VbYid","Today marks the 20th anniversary of the Animal Crossing series! What are your favorite memories? Thank you to everyone who has played throughout the years, and we look forward to sharing more memories together in the future!

If you’ve not played before, Animal Crossing: New Horizons is now available on Nintendo Switch!
http://ninten.do/6181VbYid",,2021-04-14 08:00:02,https://scontent-bog1-1.xx.fbcdn.net/v/t1.6435-9/fr/cp0/e15/q65/173591141_4037559809661775_6132733053239526565_n.jpg?_nc_cat=108&ccb=1-3&_nc_sid=2d5d41&_nc_ohc=cLF4oNr7gOAAX9cFw9_&_nc_ht=scontent-bog1-1.xx&tp=14&oh=d548b3b366eb3c0e1ccb36c90452947e&oe=609FB044,"['https://scontent-bog1-1.xx.fbcdn.net/v/t1.6435-9/fr/cp0/e15/q65/173591141_4037559809661775_6132733053239526565_n.jpg?_nc_cat=108&ccb=1-3&_nc_sid=2d5d41&_nc_ohc=cLF4oNr7gOAAX9cFw9_&_nc_ht=scontent-bog1-1.xx&tp=14&oh=d548b3b366eb3c0e1ccb36c90452947e&oe=609FB044', 'https://scontent-bog1-1.xx.fbcdn.net/v/t1.6435-9/fr/cp0/e15/q65/173591141_4037559809661775_6132733053239526565_n.jpg?_nc_cat=108&ccb=1-3&_nc_sid=2d5d41&_nc_ohc=cLF4oNr7gOAAX9cFw9_&_nc_ht=scontent-bog1-1.xx&tp=14&oh=d548b3b366eb3c0e1ccb36c90452947e&oe=609FB044', 'https://scontent-bog1-1.xx.fbcdn.net/v/t1.6435-9/fr/cp0/e15/q65/173591141_4037559809661775_6132733053239526565_n.jpg?_nc_cat=108&ccb=1-3&_nc_sid=2d5d41&_nc_ohc=cLF4oNr7gOAAX9cFw9_&_nc_ht=scontent-bog1-1.xx&tp=14&oh=d548b3b366eb3c0e1ccb36c90452947e&oe=609FB044']",,,,1958,225,0,https://facebook.com/nintendo/posts/4037559799661776,http://ninten.do/6181VbYid,119240841493711,Nintendo,False,,,,,,,True,
4035159999901756,"A new Indie World Showcase arrives on Wednesday, April 14 at 9 a.m. PT! Tune in for a livestream featuring roughly 20 minutes focused on fresh and new indie games coming to Nintendo Switch.

Watch it live here: https://nintendo.com/indie-world","A new Indie World Showcase arrives on Wednesday, April 14 at 9 a.m. PT! Tune in for a livestream featuring roughly 20 minutes focused on fresh and new indie games coming to Nintendo Switch.

Watch it live here: https://nintendo.com/indie-world",,2021-04-13 11:00:02,https://scontent-bog1-1.xx.fbcdn.net/v/t1.6435-9/fr/cp0/e15/q65/172857389_4035160003235089_8807175623805692494_n.jpg?_nc_cat=102&ccb=1-3&_nc_sid=2d5d41&_nc_ohc=dz8ia7y1NnAAX95SUXG&_nc_ht=scontent-bog1-1.xx&tp=14&oh=1ecbde359565815f0ddb32fef1c9f84c&oe=609FA468,"['https://scontent-bog1-1.xx.fbcdn.net/v/t1.6435-9/fr/cp0/e15/q65/172857389_4035160003235089_8807175623805692494_n.jpg?_nc_cat=102&ccb=1-3&_nc_sid=2d5d41&_nc_ohc=dz8ia7y1NnAAX95SUXG&_nc_ht=scontent-bog1-1.xx&tp=14&oh=1ecbde359565815f0ddb32fef1c9f84c&oe=609FA468', 'https://scontent-bog1-1.xx.fbcdn.net/v/t1.6435-9/fr/cp0/e15/q65/172857389_4035160003235089_8807175623805692494_n.jpg?_nc_cat=102&ccb=1-3&_nc_sid=2d5d41&_nc_ohc=dz8ia7y1NnAAX95SUXG&_nc_ht=scontent-bog1-1.xx&tp=14&oh=1ecbde359565815f0ddb32fef1c9f84c&oe=609FA468', 'https://scontent-bog1-1.xx.fbcdn.net/v/t1.6435-9/fr/cp0/e15/q65/172857389_4035160003235089_8807175623805692494_n.jpg?_nc_cat=102&ccb=1-3&_nc_sid=2d5d41&_nc_ohc=dz8ia7y1NnAAX95SUXG&_nc_ht=scontent-bog1-1.xx&tp=14&oh=1ecbde359565815f0ddb32fef1c9f84c&oe=609FA468']",,,,741,91,0,https://facebook.com/nintendo/posts/4035159999901756,https://nintendo.com/indie-world,119240841493711,Nintendo,False,,,,,,,True,
4023547561063000,Can you guess the Pokémon? Play along with Kit & Krysta on this episode of #NintendoMinute! #NewPokemonSnap,Can you guess the Pokémon? Play along with Kit & Krysta on this episode of #NintendoMinute! #NewPokemonSnap,,2021-04-09 17:00:00,,,https://video-bog1-1.xx.fbcdn.net/v/t42.1790-2/10000000_474657123582485_6428341924202877791_n.mp4?_nc_cat=103&ccb=1-3&_nc_sid=985c63&efg=eyJ2ZW5jb2RlX3RhZyI6InN2ZV9zZCJ9&_nc_ohc=dl9pTFbzD5gAX_yTaLn&_nc_ht=video-bog1-1.xx&oh=40ae56b67bca9c8d0c1f838f62d7c0c7&oe=60791C6B,https://scontent-bog1-1.xx.fbcdn.net/v/t15.5256-10/cp0/e15/q65/s320x320/158300065_751612692393683_6532912327156921480_n.jpg?_nc_cat=111&ccb=1-3&_nc_sid=ccf8b3&_nc_ohc=kurd2ngAEewAX9loi_j&_nc_ht=scontent-bog1-1.xx&tp=9&oh=1ae5532b39a611d857d440ab2f020bed&oe=609FFE01,751605532394399,211,44,0,https://facebook.com/nintendo/videos/751605532394399,,119240841493711,Nintendo,False,,,,,,,True,
4010599259024497,"Get ready for the Animal Crossing: New Horizons collection from Build-A-Bear Workshop, launching tomorrow! Sign up for email updates to find out when the collection is available.

Sign up here: http://ninten.do/6183VnnM5","Get ready for the Animal Crossing: New Horizons collection from Build-A-Bear Workshop, launching tomorrow! Sign up for email updates to find out when the collection is available.

Sign up here: http://ninten.do/6183VnnM5",,2021-04-05 13:35:16,https://scontent-bog1-1.xx.fbcdn.net/v/t1.6435-9/fr/cp0/e15/q65/169486308_4010599262357830_4275561215852286289_n.jpg?_nc_cat=109&ccb=1-3&_nc_sid=2d5d41&_nc_ohc=-Rey5jIbN7IAX8w8ncu&_nc_ht=scontent-bog1-1.xx&tp=14&oh=1aea10c3edbee33889b3d5837429eb9b&oe=609DC0A5,"['https://scontent-bog1-1.xx.fbcdn.net/v/t1.6435-9/fr/cp0/e15/q65/169486308_4010599262357830_4275561215852286289_n.jpg?_nc_cat=109&ccb=1-3&_nc_sid=2d5d41&_nc_ohc=-Rey5jIbN7IAX8w8ncu&_nc_ht=scontent-bog1-1.xx&tp=14&oh=1aea10c3edbee33889b3d5837429eb9b&oe=609DC0A5', 'https://scontent-bog1-1.xx.fbcdn.net/v/t1.6435-9/fr/cp0/e15/q65/169486308_4010599262357830_4275561215852286289_n.jpg?_nc_cat=109&ccb=1-3&_nc_sid=2d5d41&_nc_ohc=-Rey5jIbN7IAX8w8ncu&_nc_ht=scontent-bog1-1.xx&tp=14&oh=1aea10c3edbee33889b3d5837429eb9b&oe=609DC0A5', 'https://scontent-bog1-1.xx.fbcdn.net/v/t1.6435-9/fr/cp0/e15/q65/169486308_4010599262357830_4275561215852286289_n.jpg?_nc_cat=109&ccb=1-3&_nc_sid=2d5d41&_nc_ohc=-Rey5jIbN7IAX8w8ncu&_nc_ht=scontent-bog1-1.xx&tp=14&oh=1aea10c3edbee33889b3d5837429eb9b&oe=609DC0A5']",,,,2634,1343,0,https://facebook.com/nintendo/posts/4010599259024497,http://ninten.do/6183VnnM5,119240841493711,Nintendo,False,,,,,,,True,
4006701736080916,Hop into the holiday festivities with some egg-citing adventures! What game are you playing today?,Hop into the holiday festivities with some egg-citing adventures! What game are you playing today?,,2021-04-04 10:00:01,https://scontent-bog1-1.xx.fbcdn.net/v/t1.6435-9/fr/cp0/e15/q65/169492872_4006701739414249_4897555911623610804_n.jpg?_nc_cat=101&ccb=1-3&_nc_sid=2d5d41&_nc_ohc=9pjzgCwjdf0AX9LRwfS&_nc_ht=scontent-bog1-1.xx&tp=14&oh=f4792816fbda05e3a984c4e5288fb284&oe=609D55F3,"['https://scontent-bog1-1.xx.fbcdn.net/v/t1.6435-9/fr/cp0/e15/q65/169492872_4006701739414249_4897555911623610804_n.jpg?_nc_cat=101&ccb=1-3&_nc_sid=2d5d41&_nc_ohc=9pjzgCwjdf0AX9LRwfS&_nc_ht=scontent-bog1-1.xx&tp=14&oh=f4792816fbda05e3a984c4e5288fb284&oe=609D55F3', 'https://scontent-bog1-1.xx.fbcdn.net/v/t1.6435-9/fr/cp0/e15/q65/169492872_4006701739414249_4897555911623610804_n.jpg?_nc_cat=101&ccb=1-3&_nc_sid=2d5d41&_nc_ohc=9pjzgCwjdf0AX9LRwfS&_nc_ht=scontent-bog1-1.xx&tp=14&oh=f4792816fbda05e3a984c4e5288fb284&oe=609D55F3', 'https://scontent-bog1-1.xx.fbcdn.net/v/t1.6435-9/fr/cp0/e15/q65/169492872_4006701739414249_4897555911623610804_n.jpg?_nc_cat=101&ccb=1-3&_nc_sid=2d5d41&_nc_ohc=9pjzgCwjdf0AX9LRwfS&_nc_ht=scontent-bog1-1.xx&tp=14&oh=f4792816fbda05e3a984c4e5288fb284&oe=609D55F3']",,,,829,134,0,https://facebook.com/nintendo/posts/4006701736080916,,119240841493711,Nintendo,False,,,,,,,True,
4001564979927925,Kit & Krysta are joined by special guests Miss Click and PlayerEssence.com to hunt the Bishaten in Monster Hunter Rise on today’s episode of Nintendo Minute! Capcom USA Monster Hunter,Kit & Krysta are joined by special guests Miss Click and PlayerEssence.com to hunt the Bishaten in Monster Hunter Rise on today’s episode of Nintendo Minute! Capcom USA Monster Hunter,,2021-04-02 17:00:00,,,https://video-bog1-1.xx.fbcdn.net/v/t42.1790-2/10000000_198745198378328_4750792457484240850_n.mp4?_nc_cat=106&ccb=1-3&_nc_sid=985c63&efg=eyJ2ZW5jb2RlX3RhZyI6InN2ZV9zZCJ9&_nc_ohc=bwJ1mNF-4TgAX-NDJld&_nc_ht=video-bog1-1.xx&oh=0a19cc0e14185d8204d49fd83d5b0dfc&oe=60792202,https://scontent-bog1-1.xx.fbcdn.net/v/t15.5256-10/cp0/e15/q65/s320x320/150057212_469465591143007_8844523633225822230_n.jpg?_nc_cat=109&ccb=1-3&_nc_sid=ccf8b3&_nc_ohc=c9cAdZXpxCgAX9MAxpM&_nc_ht=scontent-bog1-1.xx&tp=9&oh=2b770d78311b116706037c5676ee87e2&oe=609FE746,469450587811174,237,31,0,https://facebook.com/nintendo/videos/469450587811174,http://PlayerEssence.com/,119240841493711,Nintendo,False,,,,,,,True,
4000758903341866,"Here's to a great March that brought us new content in Super Smash Bros. Ultimate, Among Us, Animal Crossing: New Horizons and more, and exciting releases like Monster Hunter Rise and Apex Legends! Get the rundown with the March edition of Nintendo Monthly Rewind!","Here's to a great March that brought us new content in Super Smash Bros. Ultimate, Among Us, Animal Crossing: New Horizons and more, and exciting releases like Monster Hunter Rise and Apex Legends! Get the rundown with the March edition of Nintendo Monthly Rewind!",,2021-04-02 10:04:29,,,https://video-bog1-1.xx.fbcdn.net/v/t42.1790-2/168170833_115097320608012_2094614972956122153_n.mp4?_nc_cat=106&ccb=1-3&_nc_sid=985c63&efg=eyJ2ZW5jb2RlX3RhZyI6InN2ZV9zZCJ9&_nc_ohc=jgcwpfgWOrcAX-eXF10&_nc_ht=video-bog1-1.xx&oh=9f094c8faebd6ffae8a855572fdd926d&oe=60791B09,https://scontent-bog1-1.xx.fbcdn.net/v/t15.5256-10/cp0/e15/q65/s320x320/159582106_732486124092980_8389452306710256158_n.jpg?_nc_cat=109&ccb=1-3&_nc_sid=ccf8b3&_nc_ohc=s7_YE8Ii6fMAX9z5oJJ&_nc_ht=scontent-bog1-1.xx&tp=9&oh=fac14026ff00ff65adc539b85f7b32da&oe=609CB3ED,732484080759851,344,34,0,https://facebook.com/nintendo/videos/732484080759851,,119240841493711,Nintendo,False,,,,,,,True,
3994908647260225,"Hey, Trainers! In this special episode of Nintendo Power Podcast, Chris and guests discuss 25 years of Pokémon! The group share their Pokémon memories and look ahead to the next wave of Pokémon experiences coming to Nintendo Switch.

Available now: http://ninten.do/6183VpOwU","Hey, Trainers! In this special episode of Nintendo Power Podcast, Chris and guests discuss 25 years of Pokémon! The group share their Pokémon memories and look ahead to the next wave of Pokémon experiences coming to Nintendo Switch.

Available now: http://ninten.do/6183VpOwU",,2021-03-31 15:30:00,https://scontent-bog1-1.xx.fbcdn.net/v/t1.6435-9/fr/cp0/e15/q65/167617623_3994908650593558_2230007840230062317_n.jpg?_nc_cat=111&ccb=1-3&_nc_sid=2d5d41&_nc_ohc=TyDeH3PYLpcAX_M6KxK&_nc_ht=scontent-bog1-1.xx&tp=14&oh=4e2f647613889ac2a6905af49618e490&oe=609D1E38,"['https://scontent-bog1-1.xx.fbcdn.net/v/t1.6435-9/fr/cp0/e15/q65/167617623_3994908650593558_2230007840230062317_n.jpg?_nc_cat=111&ccb=1-3&_nc_sid=2d5d41&_nc_ohc=TyDeH3PYLpcAX_M6KxK&_nc_ht=scontent-bog1-1.xx&tp=14&oh=4e2f647613889ac2a6905af49618e490&oe=609D1E38', 'https://scontent-bog1-1.xx.fbcdn.net/v/t1.6435-9/fr/cp0/e15/q65/167617623_3994908650593558_2230007840230062317_n.jpg?_nc_cat=111&ccb=1-3&_nc_sid=2d5d41&_nc_ohc=TyDeH3PYLpcAX_M6KxK&_nc_ht=scontent-bog1-1.xx&tp=14&oh=4e2f647613889ac2a6905af49618e490&oe=609D1E38', 'https://scontent-bog1-1.xx.fbcdn.net/v/t1.6435-9/fr/cp0/e15/q65/167617623_3994908650593558_2230007840230062317_n.jpg?_nc_cat=111&ccb=1-3&_nc_sid=2d5d41&_nc_ohc=TyDeH3PYLpcAX_M6KxK&_nc_ht=scontent-bog1-1.xx&tp=14&oh=4e2f647613889ac2a6905af49618e490&oe=609D1E38']",,,,330,25,0,https://facebook.com/nintendo/posts/3994908647260225,http://ninten.do/6183VpOwU,119240841493711,Nintendo,False,,,,,,,True,
3994422230642200,Thank you to everyone who joined us in commemorating the 35th anniversary of Super Mario Bros. We hope you continue to Power-Up and enjoy Mario and friends’ adventures!,Thank you to everyone who joined us in commemorating the 35th anniversary of Super Mario Bros. We hope you continue to Power-Up and enjoy Mario and friends’ adventures!,,2021-03-31 12:00:02,https://scontent-bog1-1.xx.fbcdn.net/v/t1.6435-9/fr/cp0/e15/q65/167346450_3994422233975533_1553473121351349115_n.jpg?_nc_cat=108&ccb=1-3&_nc_sid=2d5d41&_nc_ohc=pMF3I6FA96IAX_WuFk9&_nc_ht=scontent-bog1-1.xx&tp=14&oh=63398cef8ffe98ebd7fbeb67ed73a84b&oe=609DFF38,"['https://scontent-bog1-1.xx.fbcdn.net/v/t1.6435-9/fr/cp0/e15/q65/167346450_3994422233975533_1553473121351349115_n.jpg?_nc_cat=108&ccb=1-3&_nc_sid=2d5d41&_nc_ohc=pMF3I6FA96IAX_WuFk9&_nc_ht=scontent-bog1-1.xx&tp=14&oh=63398cef8ffe98ebd7fbeb67ed73a84b&oe=609DFF38', 'https://scontent-bog1-1.xx.fbcdn.net/v/t1.6435-9/fr/cp0/e15/q65/167346450_3994422233975533_1553473121351349115_n.jpg?_nc_cat=108&ccb=1-3&_nc_sid=2d5d41&_nc_ohc=pMF3I6FA96IAX_WuFk9&_nc_ht=scontent-bog1-1.xx&tp=14&oh=63398cef8ffe98ebd7fbeb67ed73a84b&oe=609DFF38', 'https://scontent-bog1-1.xx.fbcdn.net/v/t1.6435-9/fr/cp0/e15/q65/167346450_3994422233975533_1553473121351349115_n.jpg?_nc_cat=108&ccb=1-3&_nc_sid=2d5d41&_nc_ohc=pMF3I6FA96IAX_WuFk9&_nc_ht=scontent-bog1-1.xx&tp=14&oh=63398cef8ffe98ebd7fbeb67ed73a84b&oe=609DFF38']",,,,2825,522,0,https://facebook.com/nintendo/posts/3994422230642200,,119240841493711,Nintendo,False,,,,,,,True,
3981270225290734,"On this day 10 years ago, the Nintendo 3DS was released in North America! What are some of your favorite games and memories with the portable system?","On this day 10 years ago, the Nintendo 3DS was released in North America! What are some of your favorite games and memories with the portable system?",,2021-03-27 10:02:01,https://scontent-bog1-1.xx.fbcdn.net/v/t1.6435-9/fr/cp0/e15/q65/165530474_3981270228624067_5919544300208823479_n.jpg?_nc_cat=105&ccb=1-3&_nc_sid=2d5d41&_nc_ohc=R8BvFekYbMAAX8Mt3S6&_nc_ht=scontent-bog1-1.xx&tp=14&oh=bfe976b99680d2d63d071c151d93967e&oe=609F2A42,"['https://scontent-bog1-1.xx.fbcdn.net/v/t1.6435-9/fr/cp0/e15/q65/165530474_3981270228624067_5919544300208823479_n.jpg?_nc_cat=105&ccb=1-3&_nc_sid=2d5d41&_nc_ohc=R8BvFekYbMAAX8Mt3S6&_nc_ht=scontent-bog1-1.xx&tp=14&oh=bfe976b99680d2d63d071c151d93967e&oe=609F2A42', 'https://scontent-bog1-1.xx.fbcdn.net/v/t1.6435-9/fr/cp0/e15/q65/165530474_3981270228624067_5919544300208823479_n.jpg?_nc_cat=105&ccb=1-3&_nc_sid=2d5d41&_nc_ohc=R8BvFekYbMAAX8Mt3S6&_nc_ht=scontent-bog1-1.xx&tp=14&oh=bfe976b99680d2d63d071c151d93967e&oe=609F2A42', 'https://scontent-bog1-1.xx.fbcdn.net/v/t1.6435-9/fr/cp0/e15/q65/165530474_3981270228624067_5919544300208823479_n.jpg?_nc_cat=105&ccb=1-3&_nc_sid=2d5d41&_nc_ohc=R8BvFekYbMAAX8Mt3S6&_nc_ht=scontent-bog1-1.xx&tp=14&oh=bfe976b99680d2d63d071c151d93967e&oe=609F2A42']",,,,5682,1239,0,https://facebook.com/nintendo/posts/3981270225290734,,119240841493711,Nintendo,False,,,,,,,True,
3978479458903144,See a full hunt from start to finish in Monster Hunter Rise on the latest Nintendo Minute! Capcom USA Monster Hunter,See a full hunt from start to finish in Monster Hunter Rise on the latest Nintendo Minute! Capcom USA Monster Hunter,,2021-03-26 17:00:01,,,https://video-bog1-1.xx.fbcdn.net/v/t42.1790-2/10000000_460081931710798_6825747338309327845_n.mp4?_nc_cat=111&ccb=1-3&_nc_sid=985c63&efg=eyJ2ZW5jb2RlX3RhZyI6InN2ZV9zZCJ9&_nc_ohc=yDRmI8jcdBYAX96oqhm&_nc_ht=video-bog1-1.xx&oh=9c8205a9bc70d1a3c4c48740cb4cdd6b&oe=60791E4C,https://scontent-bog1-1.xx.fbcdn.net/v/t15.5256-10/cp0/e15/q65/s320x320/157921920_2780287552263329_5567988770712026701_n.jpg?_nc_cat=109&ccb=1-3&_nc_sid=ccf8b3&_nc_ohc=CrgZI6lr7AMAX_rBJ56&_nc_ht=scontent-bog1-1.xx&tp=9&oh=d04ab343291d8f595634cf996ebd48a0&oe=609D6AC2,2780273582264726,346,28,0,https://facebook.com/nintendo/videos/2780273582264726,,119240841493711,Nintendo,False,,,,,,,True,
3977334782350945,"The Animal Crossing Sanrio Collaboration Pack amiibo cards are available starting today! Use them with Animal Crossing: New Horizons and bring some Sanrio cuteness to your island.

Invite special residents to your campsite and help them relocate permanently, then pick up themed items based on characters like Hello Kitty, Cinnamaroll and more!

Available exclusively at Target!","The Animal Crossing Sanrio Collaboration Pack amiibo cards are available starting today! Use them with Animal Crossing: New Horizons and bring some Sanrio cuteness to your island.

Invite special residents to your campsite and help them relocate permanently, then pick up themed items based on characters like Hello Kitty, Cinnamaroll and more!

Available exclusively at Target!",,2021-03-26 08:00:04,https://scontent-bog1-1.xx.fbcdn.net/v/t1.6435-9/fr/cp0/e15/q65/165386604_3977334639017626_190642691018089696_n.jpg?_nc_cat=100&ccb=1-3&_nc_sid=8024bb&_nc_ohc=-KqEyk2cyMMAX8lDKVR&_nc_ht=scontent-bog1-1.xx&tp=14&oh=bf1c4dc16aa4df4674e8e0613f786e32&oe=609D8BCD,"['https://scontent-bog1-1.xx.fbcdn.net/v/t1.6435-9/fr/cp0/e15/q65/165386604_3977334639017626_190642691018089696_n.jpg?_nc_cat=100&ccb=1-3&_nc_sid=8024bb&_nc_ohc=-KqEyk2cyMMAX8lDKVR&_nc_ht=scontent-bog1-1.xx&tp=14&oh=bf1c4dc16aa4df4674e8e0613f786e32&oe=609D8BCD', 'https://scontent-bog1-1.xx.fbcdn.net/v/t1.6435-9/fr/cp0/e15/q65/165066759_3977334635684293_2293229801822697471_n.jpg?_nc_cat=102&ccb=1-3&_nc_sid=8024bb&_nc_ohc=9M14-qpBpQQAX8aMnku&_nc_ht=scontent-bog1-1.xx&tp=14&oh=414296c62e7a68466b0c44236f6f7150&oe=60A06E0E', 'https://scontent-bog1-1.xx.fbcdn.net/v/t1.6435-9/fr/cp0/e15/q65/165602447_3977334632350960_457556225656172219_n.jpg?_nc_cat=102&ccb=1-3&_nc_sid=8024bb&_nc_ohc=FXhEiNvE-iwAX9wR5Wm&_nc_ht=scontent-bog1-1.xx&tp=14&oh=ffa1ed28c53e1a8e677f7f0a62a030f9&oe=609FFAD8', 'https://scontent-bog1-1.xx.fbcdn.net/v/t1.6435-9/fr/cp0/e15/q65/165095678_3977334642350959_9071021850724874878_n.jpg?_nc_cat=106&ccb=1-3&_nc_sid=8024bb&_nc_ohc=ix99qgy7bKoAX85h-VV&_nc_ht=scontent-bog1-1.xx&tp=14&oh=a9e352cbe5af3c75cfa9536b257188cc&oe=609DF54E']",,,,1503,1229,0,https://facebook.com/nintendo/posts/3977334782350945,,119240841493711,Nintendo,False,,,,,,,True,
3968858206531936,"Don’t miss your chance to get one of these Super Mario Bros. Wave 2 collectible pin sets while supplies last! Get the full details on how to get your pins and check out your My Nintendo mission progress at the link below:

http://ninten.do/6189VPl27","Don’t miss your chance to get one of these Super Mario Bros. Wave 2 collectible pin sets while supplies last! Get the full details on how to get your pins and check out your My Nintendo mission progress at the link below:

http://ninten.do/6189VPl27",,2021-03-23 17:00:01,https://scontent-bog1-1.xx.fbcdn.net/v/t1.6435-9/fr/cp0/e15/q65/164502244_3968858216531935_1027816095127696759_n.jpg?_nc_cat=103&ccb=1-3&_nc_sid=2d5d41&_nc_ohc=DDNXyDP5lJwAX8sdr2f&_nc_ht=scontent-bog1-1.xx&tp=14&oh=5b431cdc68952dfb9b913ba46f1d2ef1&oe=609FF722,"['https://scontent-bog1-1.xx.fbcdn.net/v/t1.6435-9/fr/cp0/e15/q65/164502244_3968858216531935_1027816095127696759_n.jpg?_nc_cat=103&ccb=1-3&_nc_sid=2d5d41&_nc_ohc=DDNXyDP5lJwAX8sdr2f&_nc_ht=scontent-bog1-1.xx&tp=14&oh=5b431cdc68952dfb9b913ba46f1d2ef1&oe=609FF722', 'https://scontent-bog1-1.xx.fbcdn.net/v/t1.6435-9/fr/cp0/e15/q65/164502244_3968858216531935_1027816095127696759_n.jpg?_nc_cat=103&ccb=1-3&_nc_sid=2d5d41&_nc_ohc=DDNXyDP5lJwAX8sdr2f&_nc_ht=scontent-bog1-1.xx&tp=14&oh=5b431cdc68952dfb9b913ba46f1d2ef1&oe=609FF722', 'https://scontent-bog1-1.xx.fbcdn.net/v/t1.6435-9/fr/cp0/e15/q65/164502244_3968858216531935_1027816095127696759_n.jpg?_nc_cat=103&ccb=1-3&_nc_sid=2d5d41&_nc_ohc=DDNXyDP5lJwAX8sdr2f&_nc_ht=scontent-bog1-1.xx&tp=14&oh=5b431cdc68952dfb9b913ba46f1d2ef1&oe=609FF722']",,,,729,125,0,https://facebook.com/nintendo/posts/3968858206531936,http://ninten.do/6189VPl27,119240841493711,Nintendo,False,,,,,,,True,
3965906620160428,"What would it be like to have a more fun walking experience surrounded by Pikmin? In a new mobile app developed by Niantic and Nintendo coming later in 2021, explore the real world and create memories with your Pikmin friends.

Pre-register here! http://ninten.do/6183VOhrb","What would it be like to have a more fun walking experience surrounded by Pikmin? In a new mobile app developed by Niantic and Nintendo coming later in 2021, explore the real world and create memories with your Pikmin friends.

Pre-register here! http://ninten.do/6183VOhrb",,2021-03-22 19:02:53,https://scontent-bog1-1.xx.fbcdn.net/v/t1.6435-9/fr/cp0/e15/q65/163999159_3965906623493761_2465515230911173730_n.jpg?_nc_cat=101&ccb=1-3&_nc_sid=2d5d41&_nc_ohc=9M844XIOaAAAX_XfZYd&_nc_oc=AQngcxAv5pX_uqYtmh7bgFQBJD2U1EGdR4vBiVbrZI67AKYfe0KE1HnXVtDIGZbnN2Ns4CI6S6Y24XPXliNqvmRn&_nc_ht=scontent-bog1-1.xx&tp=14&oh=d9ecba60d3c20086412501323238958c&oe=609EBAFA,"['https://scontent-bog1-1.xx.fbcdn.net/v/t1.6435-9/fr/cp0/e15/q65/163999159_3965906623493761_2465515230911173730_n.jpg?_nc_cat=101&ccb=1-3&_nc_sid=2d5d41&_nc_ohc=9M844XIOaAAAX_XfZYd&_nc_oc=AQngcxAv5pX_uqYtmh7bgFQBJD2U1EGdR4vBiVbrZI67AKYfe0KE1HnXVtDIGZbnN2Ns4CI6S6Y24XPXliNqvmRn&_nc_ht=scontent-bog1-1.xx&tp=14&oh=d9ecba60d3c20086412501323238958c&oe=609EBAFA', 'https://scontent-bog1-1.xx.fbcdn.net/v/t1.6435-9/fr/cp0/e15/q65/163999159_3965906623493761_2465515230911173730_n.jpg?_nc_cat=101&ccb=1-3&_nc_sid=2d5d41&_nc_ohc=9M844XIOaAAAX_XfZYd&_nc_oc=AQngcxAv5pX_uqYtmh7bgFQBJD2U1EGdR4vBiVbrZI67AKYfe0KE1HnXVtDIGZbnN2Ns4CI6S6Y24XPXliNqvmRn&_nc_ht=scontent-bog1-1.xx&tp=14&oh=d9ecba60d3c20086412501323238958c&oe=609EBAFA', 'https://scontent-bog1-1.xx.fbcdn.net/v/t1.6435-9/fr/cp0/e15/q65/163999159_3965906623493761_2465515230911173730_n.jpg?_nc_cat=101&ccb=1-3&_nc_sid=2d5d41&_nc_ohc=9M844XIOaAAAX_XfZYd&_nc_oc=AQngcxAv5pX_uqYtmh7bgFQBJD2U1EGdR4vBiVbrZI67AKYfe0KE1HnXVtDIGZbnN2Ns4CI6S6Y24XPXliNqvmRn&_nc_ht=scontent-bog1-1.xx&tp=14&oh=d9ecba60d3c20086412501323238958c&oe=609EBAFA']",,,,1246,247,0,https://facebook.com/nintendo/posts/3965906620160428,http://ninten.do/6183VOhrb,119240841493711,Nintendo,False,,,,,,,True,
